[
  {
    "asset_ref": "asset_alpha",
    "first_seen_at": "2026-02-12T09:00:00Z",
    "last_observed_at": "2026-02-12T09:50:00Z",
    "event_count_total": 4,
    "persistence_duration_days": 0,
    "state_level": "persistent",
    "last_state_update": "2026-02-12T09:50:00Z"
  },
  {
    "asset_ref": "asset_beta",
    "first_seen_at": "2026-02-12T09:40:00Z",
    "last_observed_at": "2026-02-12T09:40:00Z",
    "event_count_total": 1,
    "persistence_duration_days": 0,
    "state_level": "stable",
    "last_state_update": "2026-02-12T09:40:00Z"
  }
]